{
  "schemaVersion": "1.0",
  "projectId": "SFC-DEMO-ALPHA6",
  "workOrderId": "OT-DEMO-001",
  "assetId": "PLATE-DEMO-001",
  "source": "manual-cad",
  "sourceDevice": "Windows-x64",
  "createdAt": "2026-08-02T23:55:00Z",
  "modifiedAt": "2026-08-02T23:55:00Z",
  "operator": "MedinaParra",
  "geometryConfidence": 1.0,
  "validationStatus": "operator-reviewed",
  "fcstdFile": "Pieza-Prueba-Alpha6.FCStd",
  "stepFile": "Pieza-Prueba-Alpha6.step",
  "sourceImages": [],
  "notes": "Parametric plate generated by the alpha.6 validation workflow.",
  "corrections": [
    {
      "timestamp": "2026-08-02T23:55:00Z",
      "field": "HoleDiameter",
      "previousValue": 22.0,
      "newValue": 30.0,
      "operator": "CI validation"
    }
  ]
}
